{
  "$schema": "urn:watchtower:schema:artifacts:plan:discrepancy-record:v1",
  "discrepancy_id": "discrepancy.repository_validation_repair_loop_closeout.promotion_index_index_drift",
  "initiative_id": "initiative.repository_validation_repair_loop_closeout",
  "category": "stale_aggregate_index",
  "severity": "high",
  "gate_effect": "readiness",
  "status": "resolved",
  "summary": "Aggregate index drift detected for plan/.wt/indexes/promotion_index.json.",
  "source_paths": [
    "plan/.wt/indexes/promotion_index.json"
  ],
  "resolution_owner": "repository_maintainer",
  "detected_at": "2026-03-23T05:22:38Z",
  "updated_at": "2026-03-23T05:22:54Z"
}
