{
  "$schema": "urn:watchtower:schema:artifacts:plan:discrepancy-record:v1",
  "discrepancy_id": "discrepancy.plan_template_section_spec_enforcement_foundation.plan_surface_drift",
  "initiative_id": "initiative.plan_template_section_spec_enforcement_foundation",
  "category": "stale_rendered_surface",
  "severity": "high",
  "gate_effect": "readiness",
  "status": "resolved",
  "summary": "Rendered surface drift detected for plan/initiatives/plan_template_section_spec_enforcement_foundation/plan.md.",
  "source_paths": [
    "plan/initiatives/plan_template_section_spec_enforcement_foundation/plan.md"
  ],
  "resolution_owner": "repository_maintainer",
  "detected_at": "2026-03-17T18:05:30Z",
  "updated_at": "2026-03-17T18:06:15Z"
}
