{
  "$schema": "urn:watchtower:schema:artifacts:plan:discrepancy-record:v1",
  "discrepancy_id": "discrepancy.plan_live_query_authority_cutover.summary_surface_drift",
  "initiative_id": "initiative.plan_live_query_authority_cutover",
  "category": "stale_rendered_surface",
  "severity": "high",
  "gate_effect": "readiness",
  "status": "resolved",
  "summary": "Rendered surface drift detected for plan/initiatives/plan_live_query_authority_cutover/summary.md.",
  "source_paths": [
    "plan/initiatives/plan_live_query_authority_cutover/summary.md"
  ],
  "resolution_owner": "repository_maintainer",
  "detected_at": "2026-03-17T19:36:50Z",
  "updated_at": "2026-03-17T19:37:44Z"
}
