{
  "$schema": "urn:watchtower:schema:artifacts:plan:discrepancy-record:v1",
  "discrepancy_id": "discrepancy.plan_template_section_spec_enforcement_foundation.initiative_index_index_drift",
  "initiative_id": "initiative.plan_template_section_spec_enforcement_foundation",
  "category": "stale_aggregate_index",
  "severity": "high",
  "gate_effect": "readiness",
  "status": "resolved",
  "summary": "Aggregate index drift detected for plan/.wt/indexes/initiative_index.json.",
  "source_paths": [
    "plan/.wt/indexes/initiative_index.json"
  ],
  "resolution_owner": "repository_maintainer",
  "detected_at": "2026-03-17T18:05:30Z",
  "updated_at": "2026-03-17T18:06:15Z"
}
