{
  "$schema": "urn:watchtower:schema:artifacts:plan:discrepancy-record:v1",
  "discrepancy_id": "discrepancy.core_removable_plan_reference_cleanup.artifact_index_index_drift",
  "initiative_id": "initiative.core_removable_plan_reference_cleanup",
  "category": "stale_aggregate_index",
  "severity": "high",
  "gate_effect": "readiness",
  "status": "resolved",
  "summary": "Aggregate index drift detected for plan/.wt/indexes/artifact_index.json.",
  "source_paths": [
    "plan/.wt/indexes/artifact_index.json"
  ],
  "resolution_owner": "repository_maintainer",
  "detected_at": "2026-03-22T23:13:33Z",
  "updated_at": "2026-03-22T23:13:51Z"
}
