{
  "$schema": "urn:watchtower:schema:artifacts:plan:discrepancy-record:v1",
  "discrepancy_id": "discrepancy.core_governance_reference_deplanification_followup.implementation_slice_drift",
  "initiative_id": "initiative.core_governance_reference_deplanification_followup",
  "category": "authored_input_drift",
  "severity": "high",
  "gate_effect": "readiness",
  "status": "resolved",
  "summary": "Authored input drift detected for plan/initiatives/core_governance_reference_deplanification_followup/implementation_slice.md; machine confirmation is required.",
  "source_paths": [
    "plan/initiatives/core_governance_reference_deplanification_followup/implementation_slice.md"
  ],
  "resolution_owner": "repository_maintainer",
  "detected_at": "2026-03-23T16:35:32Z",
  "updated_at": "2026-03-23T16:36:09Z"
}
