{
  "$schema": "urn:watchtower:schema:artifacts:plan:discrepancy-record:v1",
  "discrepancy_id": "discrepancy.plan_lifecycle_review_and_source_vocab_registries.progress_surface_drift",
  "initiative_id": "initiative.plan_lifecycle_review_and_source_vocab_registries",
  "category": "stale_rendered_surface",
  "severity": "high",
  "gate_effect": "readiness",
  "status": "resolved",
  "summary": "Rendered surface drift detected for plan/initiatives/plan_lifecycle_review_and_source_vocab_registries/progress.md.",
  "source_paths": [
    "plan/initiatives/plan_lifecycle_review_and_source_vocab_registries/progress.md"
  ],
  "resolution_owner": "repository_maintainer",
  "detected_at": "2026-03-17T17:04:19Z",
  "updated_at": "2026-03-17T17:04:47Z"
}
