{
  "$schema": "urn:watchtower:schema:artifacts:plan:discrepancy-record:v1",
  "discrepancy_id": "discrepancy.repository_validation_repair_loop_closeout.progress_surface_drift",
  "initiative_id": "initiative.repository_validation_repair_loop_closeout",
  "category": "stale_rendered_surface",
  "severity": "high",
  "gate_effect": "readiness",
  "status": "resolved",
  "summary": "Rendered surface drift detected for plan/initiatives/repository_validation_repair_loop_closeout/progress.md.",
  "source_paths": [
    "plan/initiatives/repository_validation_repair_loop_closeout/progress.md"
  ],
  "resolution_owner": "repository_maintainer",
  "detected_at": "2026-03-23T05:22:36Z",
  "updated_at": "2026-03-23T05:22:54Z"
}
