{
  "$schema": "urn:watchtower:schema:artifacts:plan:discrepancy-record:v1",
  "discrepancy_id": "discrepancy.pack_starter_templates_and_oversight_alignment.review_index_index_drift",
  "initiative_id": "initiative.pack_starter_templates_and_oversight_alignment",
  "category": "stale_aggregate_index",
  "severity": "high",
  "gate_effect": "readiness",
  "status": "resolved",
  "summary": "Aggregate index drift detected for plan/.wt/indexes/review_index.json.",
  "source_paths": [
    "plan/.wt/indexes/review_index.json"
  ],
  "resolution_owner": "repository_maintainer",
  "detected_at": "2026-03-21T01:50:17Z",
  "updated_at": "2026-03-21T01:51:45Z"
}
