{
  "$schema": "urn:watchtower:schema:artifacts:plan:discrepancy-record:v1",
  "discrepancy_id": "discrepancy.watchtower.watchtower_initial_implementation_bootstrap.project_index_project_drift",
  "initiative_id": "initiative.watchtower_initial_implementation_bootstrap",
  "category": "stale_aggregate_index",
  "severity": "high",
  "gate_effect": "readiness",
  "status": "resolved",
  "summary": "Project aggregate index drift detected for plan/.wt/indexes/project_index.json.",
  "source_paths": [
    "plan/.wt/indexes/project_index.json"
  ],
  "resolution_owner": "repository_maintainer",
  "detected_at": "2026-03-17T06:39:07Z",
  "updated_at": "2026-03-17T06:41:23Z"
}
