{
  "$schema": "urn:watchtower:schema:artifacts:plan:discrepancy-record:v1",
  "discrepancy_id": "discrepancy.core_governance_reference_deplanification_followup.closeout_index_index_drift",
  "initiative_id": "initiative.core_governance_reference_deplanification_followup",
  "category": "stale_aggregate_index",
  "severity": "high",
  "gate_effect": "readiness",
  "status": "resolved",
  "summary": "Aggregate index drift detected for plan/.wt/indexes/closeout_index.json.",
  "source_paths": [
    "plan/.wt/indexes/closeout_index.json"
  ],
  "resolution_owner": "repository_maintainer",
  "detected_at": "2026-03-23T16:35:34Z",
  "updated_at": "2026-03-23T16:36:09Z"
}
