{
  "$schema": "urn:watchtower:schema:artifacts:plan:discrepancy-record:v1",
  "discrepancy_id": "discrepancy.plan_legacy_history_retention_reconciliation.readiness_index_index_drift",
  "initiative_id": "initiative.plan_legacy_history_retention_reconciliation",
  "category": "stale_aggregate_index",
  "severity": "high",
  "gate_effect": "readiness",
  "status": "resolved",
  "summary": "Aggregate index drift detected for plan/.wt/indexes/readiness_index.json.",
  "source_paths": [
    "plan/.wt/indexes/readiness_index.json"
  ],
  "resolution_owner": "repository_maintainer",
  "detected_at": "2026-03-17T09:38:41Z",
  "updated_at": "2026-03-17T09:39:05Z"
}
