{
  "$schema": "urn:watchtower:schema:artifacts:plan:discrepancy-record:v1",
  "discrepancy_id": "discrepancy.plan_documentation_family_and_template_catalog_foundation.coordination_index_index_drift",
  "initiative_id": "initiative.plan_documentation_family_and_template_catalog_foundation",
  "category": "stale_aggregate_index",
  "severity": "high",
  "gate_effect": "readiness",
  "status": "resolved",
  "summary": "Aggregate index drift detected for plan/.wt/indexes/coordination_index.json.",
  "source_paths": [
    "plan/.wt/indexes/coordination_index.json"
  ],
  "resolution_owner": "repository_maintainer",
  "detected_at": "2026-03-17T17:42:49Z",
  "updated_at": "2026-03-17T17:43:02Z"
}
