{
  "$schema": "urn:watchtower:schema:artifacts:plan:discrepancy-record:v1",
  "discrepancy_id": "discrepancy.root_pack_schema_catalog_contract_alignment.design_record_drift",
  "initiative_id": "initiative.root_pack_schema_catalog_contract_alignment",
  "category": "authored_input_drift",
  "severity": "high",
  "gate_effect": "readiness",
  "status": "resolved",
  "summary": "Authored input drift detected for plan/initiatives/root_pack_schema_catalog_contract_alignment/design_record.md; machine confirmation is required.",
  "source_paths": [
    "plan/initiatives/root_pack_schema_catalog_contract_alignment/design_record.md"
  ],
  "resolution_owner": "repository_maintainer",
  "detected_at": "2026-03-22T22:59:25Z",
  "updated_at": "2026-03-22T22:59:51Z"
}
